code	address	place	lat	lon
1-1	京都市伏見区深草正覚町12番地の3	鳥羽街道団地(南側)	34.9724673	135.7718086
1-2	京都市伏見区深草相深町8-5	高松橋ひろば	34.9730183	135.7695256
1-3	京都市伏見区深草正覚町12番地の3	鳥羽街道団地(北側)	34.9738366	135.7719802
1-4	京都市伏見区深草開土町12番地の1	稲荷小学校(北東側)		
1-5	京都市伏見区深草藪之内町30番地の4	伏見稲荷大社所有地	34.9659625	135.773249
1-6	京都市伏見区深草稲荷御前町110番地	JR稲荷駅(東側)		
1-7	京都市伏見区深草大門町	京都市深草墓園	34.9648313	135.7737476
2-1	京都市伏見区深草下高松町35番地の10	相深公園	34.9726285	135.7683817
2-2	京都市伏見区深草鈴塚町6番地の1	鈴塚市営住宅2棟(東側)	34.9694704	135.7675823
2-3	京都市伏見区深草下川原町40番地	旭建鉄株式会社	34.96651	135.7625921
2-4	京都市伏見区深草下川原町20番地	伏見稲荷大社第四駐車場(南側)	34.9685649	135.7640157
2-5	京都市伏見区深草平田町9番地の1	伏見稲荷大社第一駐車場		
2-6	京都市伏見区深草下川原町1番地の1	コトーハイツ伏見稲荷公園(東側)		
2-7	京都市伏見区深草勧進橋町51番地の1	増井徳太郎方		
3-1	京都市伏見区深草西浦町二丁目2番地の1	深草西浦住宅(東側)	34.9625822	135.7653034
3-2	京都市伏見区深草ケナサ町25番地の5	砂川小学校(北側)		
3-3	京都市伏見区深草ケナサ町25番地の5	砂川小学校(西側)	34.9639916	135.7685157
3-4	京都市伏見区深草西浦町二丁目2番地の1	深草西浦住宅(北側)		
3-5	京都市伏見区深草西浦町一丁目17番地	深草砂川西公園	34.9614002	135.7630485
3-6	京都市伏見区深草西浦町四丁目44番地	深草砂川東公園	34.9618453	135.7672153
4-1	京都市伏見区深草田谷町3番地	ヌヴェール愛徳修道会	34.9594116	135.7733817
4-2	京都市伏見区深草僧坊町36番地	辻井章雄方		
4-3	京都市伏見区深草西出町64番地	深草幼稚園	34.960165	135.7727541
4-4	京都市伏見区深草瓦町66番地の4	瓦町公園(北側)	34.9565071	135.7770915
4-5	京都市伏見区深草坊町4番地	瑞光寺	34.9615958	135.7750592
5-1	京都市伏見区深草極楽町764番地	京阪藤森駅(西側)	34.9564821	135.7703532
5-2	京都市伏見区深草東伊達町	東伊達町東部ちびっこひろば	34.9541849	135.7783559
5-3	京都市伏見区深草西伊達町1番地の4	深草中学校	34.9563108	135.7756323
5-4	京都市伏見区深草向畑町92番地の1	ルネ藤の森(北側)		
5-5	京都市伏見区深草西伊達町82番地の3	深草小学校	34.9561141	135.7713152
5-6	京都市伏見区深草西伊達町	深草第三市営住宅駐車場	34.954543	135.7742333
5-7	京都市伏見区深草西伊達町1番地	深草第三市営住宅4号棟(東側)	34.9549186	135.7753845
5-8	京都市伏見区深草鞍ケ谷13番地の32	鞍ケ谷公園	34.9557892	135.783666
6-1	京都市伏見区深草西浦町五丁目1番地	NTT西日本京都支店深草別館(西側)	34.9593239	135.7669943
6-2	京都市伏見区深草西浦町六丁目65番地の1	深草市街地住宅	34.957823	135.7656284
6-3	京都市伏見区深草池ノ内町55番地	藤森中学校(西側)	34.9559163	135.764231
6-4	京都市伏見区深草池ノ内町2番地	深草児童館	34.9543315	135.7624012
6-5	京都市伏見区深草池ノ内町55番地	藤森中学校(南側)		
6-6	京都市伏見区深草五反田町111番地	西浦南公園		
6-7	京都市伏見区深草池ノ内町3番地の2	七瀬川公園	34.9530332	135.7640923
6-8	京都市伏見区深草新門丈町227番地	小久保公園	34.9506048	135.7600034
7-1	京都市伏見区深草十九軒町540番地	十九軒町ガレージ	34.9513886	135.7706046
7-2	京都市伏見区深草藤森玄蕃町576番地の8	加藤正弘方	34.9494564	135.7701608
7-3	京都市伏見区深草石橋町11番地の2	藤ノ森小学校	34.9489114	135.771118
7-4	京都市伏見区深草大亀谷西久宝寺町5番地	国立病院機構京都医療センター(東側)	34.9539981	135.7763243
7-5	京都市伏見区深草大亀谷大山町99番地の3	JR藤森駅(南側)	34.9479737	135.7758446
7-6	京都市伏見区深草石橋町8番地の1	大久保禎三方	34.9471777	135.7715496
7-7	京都市伏見区深草中ノ島町13番地	府営住宅墨染団地1棟(南側)	34.9467533	135.7698534
8-1	京都市伏見区深草大亀谷万帖敷町180番地の4	高橋善雄方	34.9463997	135.7768025
8-2	京都市伏見区深草大亀谷大山町27番地の58	西大山公園	34.9471904	135.7794776
8-3	京都市伏見区深草大亀谷大山町53番地の18	大山公園		
8-4	京都市伏見区深草大亀谷安信町74番地	安信公園	34.9401649	135.7851573
8-5	京都市伏見区深草大亀谷万帖敷町481番地	万帖敷公園	34.9440653	135.7801757
8-6	京都市伏見区深草大亀谷岩山町195番地	岩山公園	34.9414352	135.7861488
8-7	京都市伏見区深草大亀谷五郎太町37番地	藤城小学校	34.9422381	135.7756028
8-8	京都市伏見区深草大亀谷東古御香町104番地	東古御香公園	34.9442293	135.7867112
8-9	京都市伏見区深草大亀谷万帖敷町894番地	万帖敷第二公園	34.9443468	135.7757554
8-10	京都市伏見区深草大亀谷六躰町125	六躰公園	34.9456647	135.774634
9-1	京都市伏見区深草越後屋敷町63番地の1	サングレールアペックス	34.9508197	135.763033
9-2	京都市伏見区深草越後屋敷町62番地	深草市営住宅1号棟南側児童遊園	34.9516964	135.7648224
9-3	京都市伏見区深草北鍵屋町988	府営住宅深草鍵屋団地2号棟(北側)	34.9500138	135.7682531
9-4	京都市伏見区深草越後屋敷町123番地の2	越後屋敷公園	34.9499729	135.7633517
9-5	京都市伏見区深草柴田屋敷町	ちびっこひろば(南側)	34.9460101	135.762512
9-6	京都市伏見区深草墨染町40番地の5	藤澤知章方		
9-7	京都市伏見区深草佐野屋敷町2番地の4	山中茂方	34.9480454	135.7655149
9-8	京都市伏見区深草北鍵屋町990番地の3	北鍵屋公園(西側)	34.9497539	135.7671325
10-1	京都市伏見区竹田流池町121番地の3	京都府立京都高等技術専門校	34.9637523	135.7577343
10-2	京都市伏見区竹田中川原町1番地の1	ミルキーマンション	34.9609248	135.7612709
10-3	京都市伏見区竹田中川原町32番地	大矢恵一方		
10-4	京都市伏見区竹田桶ノ井町8番地の2	竹田小学校(西側1つ目)	34.9554932	135.7569811
10-5	京都市伏見区竹田桶ノ井町8番地の2	竹田小学校(南側)	34.9544776	135.7571421
10-6	京都市伏見区竹田内畑町189番地	弘田富一方		
10-7	京都市伏見区竹田中内畑町59番地	内畑公園(北側)	34.9541027	135.7539175
10-8	京都市伏見区竹田中内畑町59番地	内畑公園(南側)	34.9536543	135.7538692
10-9	京都市伏見区竹田西段川原町18番地	車両工場竹田検車区(南側)	34.9567709	135.7552599
10-10	京都市伏見区竹田田中殿町94番地	田中殿公園(東側)	34.9539537	135.7497507
10-11	京都市伏見区竹田桶ノ井町8番地の2	竹田小学校(西側2つ目)	34.9551151	135.756611
11-1	京都市伏見区深草加賀屋敷町15番地	加賀屋敷公園(北側)	34.9479558	135.7580467
11-2	京都市伏見区竹田狩賀町	中央緑地(西側)	34.9473365	135.7561524
11-3	京都市伏見区竹田醍醐田町41番地の8	改進市営住宅4棟前	34.9489564	135.7560015
11-4	京都市伏見区竹田田中宮町90番地	関西電力送配電株式会社所有地	34.9486825	135.7544012
11-5	京都市伏見区深草加賀屋敷町5番地の1	加賀屋敷市営住宅1棟前	34.9491691	135.7582926
11-6	京都市伏見区深草泓ノ壺町5番地の4	泓ノ壺町ガスガバナ	34.9473943	135.7597406
11-7	京都市伏見区竹田狩賀町97番地	中央緑地(東側)	34.9477519	135.7567361
11-8	京都市伏見区深草加賀屋敷町	改進第二乳児保育所跡地	34.947379	135.7583051
12-1	京都市伏見区景勝町50番地の2	信和化工株式会社	34.9446905	135.7561002
12-2	京都市伏見区舞台町35番地の5	舞台町第二公園	34.9425293	135.7548348
12-3	京都市伏見区鳥羽町688番地	野村宗嗣方	34.9448723	135.7574917
12-4	京都市伏見区榎町713番地	悟愼寺	34.9425055	135.7587688
12-5	京都市伏見区越前町613番地	住吉公園(西側)	34.9431697	135.7602756
12-6	京都市伏見区住吉町455番地	伏見住吉小学校(東側)	34.9434669	135.7630448
12-7	京都市伏見区住吉町455番地	伏見住吉小学校(南側)	34.9430975	135.76209
12-8	京都市伏見区越前町613番地	住吉公園(東側)	34.9428795	135.7609193
13-1	京都市伏見区桃山福島太夫北町52番地	呉竹総合支援学校(南側)	34.9387708	135.7706312
13-2	京都市伏見区桃山筒井伊賀東町46番地	京都教育大学附属桃山小学校(北側)	34.9397467	135.7667394
13-3	京都市伏見区桃山筒井伊賀東町46番地	京都教育大学附属桃山小学校(南側)	34.9385066	135.7668575
13-4	京都市伏見区桃山羽柴長吉西町	京阪電車京町踏切上手(東側)	34.9363913	135.765277
13-5	京都市伏見区桃山毛利長門西町58番地の2	京都府総合教育センター		
13-6	京都市伏見区桃山羽柴長吉中町46番地の39	羽柴長吉中公園	34.935333	135.7666251
14-1	京都市伏見区東堺町545番地の2	玉乃光酒造株式会社(西側)	34.9376137	135.7576038
14-2	京都市伏見区鷹匠町39番地の2	伏見区役所(東側)	34.9359065	135.762196
14-3	京都市伏見区東菱屋町414番地	月桂冠株式会社昭和蔵(北側)	34.9353173	135.7569369
14-4	京都市伏見区京町南七丁目35番地の1	京都市呉竹文化センター	34.9377426	135.7649244
14-5	京都市伏見区下板橋町610番地	伏見板橋小学校	34.9380491	135.7622295
14-6	京都市伏見区御駕籠町97番地	伏見中学校(南側)	34.9374614	135.7603977
14-7	京都市伏見区鷹匠町39番地の2	伏見区役所(西側)	34.9358273	135.7610588
14-8	京都市伏見区新町六丁目465番地	NTT西日本京都支店伏見営業所(北側)	34.9353094	135.7635005
15-1	京都市伏見区北寝小屋町38番地	倉橋護謨工業株式会社	34.9386692	135.7499623
15-2	京都市伏見区川東町14番地の2	川東北第二公園	34.9397126	135.7544659
15-3	京都市伏見区川東町8番地の6	川東北公園	34.9379019	135.7544231
15-4	京都市伏見区恵美酒町929番地	コスモ石油駐車場	34.9329701	135.7552778
15-5	京都市伏見区聚楽町一丁目716番地	石山木材株式会社		
15-6	京都市伏見区川東町3番地の5	川東公園	34.9369974	135.7548678
16-1	京都市伏見区中島宮ノ前町96番地	堀端公園	34.9488529	135.7489161
16-2	京都市伏見区下鳥羽北ノ口町27番地	下鳥羽市営住宅(南側)	34.940772	135.7459494
16-3	京都市伏見区中島御所ノ内町12番地	鳥羽離宮跡公園(東側)	34.9488632	135.7445305
16-4	京都市伏見区下鳥羽長田町203番地	下鳥羽小学校(東側)	34.938864	135.7445166
16-5	京都市伏見区下鳥羽南三町68番地	関西電力送配電株式会社所有地		
16-6	京都市伏見区下鳥羽長田町203番地	下鳥羽小学校(南側)	34.9386441	135.7431433
16-7	京都市伏見区下鳥羽中円面田町58番地	円面田公園(北東側)	34.9331744	135.7420798
16-8	京都市伏見区下鳥羽上三栖町161番地	上三栖公園	34.9317217	135.7470656
16-9	京都市伏見区下鳥羽中円面田町58番地	円面田公園(西側)	34.9330072	135.7408353
17-1	京都市伏見区久我森の宮町4番地の98	森の宮第四公園	34.9410177	135.7296471
17-2	京都市伏見区久我東町60番地の2	神川小学校(北側)	34.939552	135.7331203
17-3	京都市伏見区羽束師鴨川町270番地の64	羽束師鴨川第二公園	34.939646	135.734648
17-4	京都市伏見区久我東町60番地の2	神川小学校(南側)	34.9381448	135.7326482
17-5	京都市伏見区久我森の宮町11番地の71	森の宮第五公園	34.9379198	135.7269136
17-6	京都市伏見区久我森の宮町9番地の36	尾崎るみ子方	34.9378618	135.7304522
17-7	京都市伏見区久我森の宮町7番地の37	森の宮西公園	34.9398983	135.7291871
18-1	京都市伏見区久我森の宮町10番地の37	久我森の宮公園	34.9372366	135.7284831
18-2	京都市伏見区久我森の宮町13番地の58	森の宮第二公園	34.9362541	135.7264548
18-3	京都市伏見区久我東町4番地の18	久我の杜第6駐車場	34.9355234	135.7279628
18-4	京都市伏見区羽束師鴨川町199番地の8	羽束師鴨川第四公園	34.9318177	135.732275
18-5	京都市伏見区久我東町216番地	久我の杜センタープラザ内広場	34.9353492	135.7282916
18-6	京都市伏見区久我東町209番地	久我の杜小学校(北東側)	34.9336475	135.7300951
18-7	京都市伏見区久我東町205番地	久我東第三公園	34.9339571	135.7289141
18-8	京都市伏見区久我東町209番地	久我の杜小学校(南側)	34.932658	135.7291778
18-9	京都市伏見区久我西出町14番地の23	久我西出公園	34.9349163	135.7251311
19-1	京都市伏見区羽束師古川町644番地の1	府営住宅羽束師団地4号棟前	34.9257928	135.7267649
19-2	京都市伏見区羽束師古川町18番地の6	古川公園	34.9279561	135.7255857
19-3	京都市伏見区羽束師古川町177番地	介護老人保健施設京しみず駐車場	34.9246765	135.7229238
19-4	京都市伏見区羽束師志水町165番地の263	西志水公園	34.9294657	135.7237663
19-5	京都市伏見区羽束師菱川町1番地	京都中央農業協同組合羽束師支店	34.9313279	135.7202605
19-6	京都市伏見区羽束師菱川町741番地	神川中学校	34.9313396	135.7216619
19-7	京都市伏見区羽束師志水町138番地の7	北志水公園	34.931529	135.7258107
19-8	京都市伏見区羽束師古川町566番地の6	南古川公園	34.9235481	135.7219659
19-9	京都市伏見区羽束師古川町116番地の4	東古川公園	34.9267438	135.7275785
19-10	京都市伏見区羽束師菱川町610番地の1	菱川第七公園	34.9326071	135.7235914
20-1	京都市伏見区横大路一本木3番地の5	関西電力送配電株式会社所有地	34.9211491	135.7331163
20-2	京都市伏見区横大路貴船52番地の29	貴船公園	34.9277869	135.7380772
20-3	京都市伏見区横大路草津町54番地の1	横大路小学校	34.9281101	135.7347316
20-4	京都市伏見区横大路柿ノ本町1番地の26	国分西日本株式会社(北西角)	34.9266677	135.7366342
20-5	京都市伏見区横大路天王前1番地の1	伏見日光ハイツ2棟(南側)	34.926817	135.7402835
20-6	京都市伏見区横大路柿ノ本町1番地の26	国分西日本株式会社(府道側)	34.9261179	135.7379324
20-7	京都市伏見区横大路富ノ森町26番地	湯浅生子方		
21-1	京都市伏見区納所中河原3番地の3	納所和泉屋公園	34.9134267	135.7227746
21-2	京都市伏見区納所妙徳寺1番地	納所小学校(南側)	34.9092815	135.7196047
21-3	京都市伏見区納所薬師堂1番地の59	薬師堂南公園	34.9089442	135.7220423
21-4	京都市伏見区納所妙徳寺1番地	納所小学校(東側)	34.909695	135.7205649
21-5	京都市伏見区納所下野27番地の10	下野第三公園		
21-6	京都市伏見区納所薬師堂1番地の136	薬師堂北公園	34.9093709	135.7215702
21-7	京都市伏見区納所中河原17番地の6	納所中河原公園	34.9133768	135.7236804
22-1	京都市伏見区淀大下津町19番地の2	大下津公園	34.9072613	135.7113354
22-2	京都市伏見区淀水垂町330番地の56	水垂会館	34.9121624	135.7138999
22-3	京都市伏見区淀樋爪町159番地の6	樋爪公園	34.9201128	135.7215704
22-4	京都市伏見区淀樋爪町441番地	阪田製作所		
23-1	京都市伏見区淀下津町257番地の7	大淀中学校(西側)	34.9020126	135.7228926
23-2	京都市伏見区淀池上町131番地の1	伏見区役所淀出張所		
23-3	京都市伏見区淀池上町106番地	明親小学校(南側)	34.9033057	135.7211731
23-4	京都市伏見区淀新町134番地の96	淀新町第三公園		
23-5	京都市伏見区淀新町	淀緑地(淀新町バス停前)		
23-6	京都市伏見区淀本町174番地の56	淀城跡公園予定地		
23-7	京都市伏見区淀新町	淀緑地(北側)		
23-8	京都市伏見区淀木津町603番地の14	淀木津公園		
23-9	京都市伏見区淀池上町106番地	明親小学校(北側)	34.9039393	135.721098
23-10	京都市伏見区淀下津町257番地の7	大淀中学校(東側)	34.9015639	135.7237992
24-1	京都市伏見区淀美豆町1244番地	美豆小学校	34.8977819	135.7135734
24-2	京都市伏見区淀美豆町269番地	NTT西日本京都支店淀別館	34.8988324	135.7144453
24-3	京都市伏見区淀美豆町395番地	筒井真理子方		
24-4	京都市伏見区淀美豆町292番地	横山昌方	34.8992975	135.7159634
25-1	京都市伏見区淀際目町240番地の1	府営住宅淀際目団地公園(東側)	34.8897498	135.719595
25-2	京都市伏見区淀際目町355番地	村田光司方		
25-3	京都市伏見区淀生津町653番地の97	生津公園		
25-4	京都市伏見区淀生津町16番地	ケイコン株式会社京都営業所	34.885442	135.7268102
25-5	京都市伏見区淀際目町340番地の9	際目公園	34.8917125	135.7184809
25-6	京都市伏見区淀生津町235番地の143	生津第二公園	34.8830809	135.7271322
25-7	京都市伏見区淀生津町441番地	可畑稔方		
26-1	京都市伏見区山崎町357番地	株式会社ナカムラ酵素伏見ガレージ	34.9311658	135.7574579
26-2	京都市伏見区横大路下三栖山殿5番地の3	山殿公園	34.9289119	135.7543905
26-3	京都市伏見区下鳥羽但馬町137番地	株式会社津賀自動車京都南営業所		
26-4	京都市伏見区北浜町604番地	北浜公園	34.9298799	135.7577834
26-5	京都市伏見区阿波橋町401番地	千歳正勝方	34.9322853	135.7552276
26-6	京都市伏見区三栖町一丁目光徳寺東旧高瀬川河川敷	旧高瀬川沿敷地	34.9303807	135.7555947
26-7	京都市伏見区表町578番地	伏見土木みどり事務所	34.9294556	135.7587345
27-1	京都市伏見区下油掛町898番地	西岸寺墓地(西側)	34.9316552	135.7588125
27-2	京都市伏見区南浜町248番地の1	南浜駐車場	34.9306366	135.7614021
27-3	京都市伏見区桃陵町1番地の1	桃陵中学校	34.9282283	135.7658954
27-4	京都市伏見区東奉行町4番地	桃陵市営住宅管理事務所横駐車場	34.9311202	135.7673638
27-5	京都市伏見区片桐町1番地	桃陵市営住宅10棟(南側)	34.9317078	135.766461
27-6	京都市伏見区丹後町142番地	伏見南浜小学校(東側)	34.9286578	135.7632691
27-7	京都市伏見区丹後町142番地	伏見南浜小学校(南側)	34.9282796	135.7627487
27-8	京都市伏見区西柳町577番地	南浜児童館		
28-1	京都市伏見区向島善阿弥町2番地の3	向島小学校(南側)	34.9260367	135.7711616
28-2	京都市伏見区向島吹田河原町138番地	向島東中学校(西側)	34.9256716	135.777141
28-3	京都市伏見区向島善阿弥町2番地の3	向島小学校(西側)	34.9264062	135.7704106
28-4	京都市伏見区向島立河原町72番地の4	立河原公園		
28-5	京都市伏見区向島本丸町	和株式会社貸ガレージ	34.9238875	135.7707704
28-6	京都市伏見区向島藤ノ木町116番地の3	関西電力送配電株式会社所有地	34.9235908	135.7835383
28-7	京都市伏見区向島吹田河原町138番地	向島東中学校(南側)	34.9253461	135.7780422
29-1	京都市伏見区向島藤ノ木町82番地の5	向島藤の木小学校(東側)	34.9209385	135.7806776
29-2	京都市伏見区向島丸町36番地の60	丸町公園(南側)	34.9221594	135.777467
29-3	京都市伏見区向島鷹場町104番地の1	向島学生センター(南側)	34.9185516	135.7804592
29-4	京都市伏見区向島藤ノ木町82番地の5	向島藤の木小学校(南側)	34.9200764	135.780581
29-5	京都市伏見区向島藤ノ木町72番地の7	向島東公園(北側)	34.9200926	135.7779139
29-6	京都市伏見区向島鷹場町74番地の4	向島東公園西側緑地	34.9186466	135.7786671
29-7	京都市伏見区向島藤ノ木町85番地の14	向島ニュータウン9街区西側第13駐車場	34.9203908	135.7783567
30-1	京都市伏見区向島津田町91番地の62	津田第三公園		
30-2	京都市伏見区向島津田町95番地の1	元向島南小学校(正門横)	34.9234404	135.7663024
30-3	京都市伏見区向島津田町121番地の23	津田公園	34.9206352	135.7672523
30-4	京都市伏見区向島上林町34番地の6	上林公園	34.9195235	135.7631703
30-5	京都市伏見区向島津田町58番地の17	北津田公園	34.9213122	135.7650194
30-6	京都市伏見区向島二ノ丸町1番地の3	北川昇方		
30-7	京都市伏見区向島津田町136番地の4	南津田公園	34.9200134	135.7667733
30-8	京都市伏見区向島中島町107番地の1	向島中島公園	34.9196474	135.7687719
30-9	京都市伏見区向島上林町8番地の26	北上林公園	34.920221	135.7628704
31-1	京都市伏見区向島四ツ谷池14番地の33	向島ニュータウン第1駐車場	34.9201532	135.7753785
31-2	京都市伏見区向島四ツ谷池14番地の1	向島市営住宅5街区集会所	34.9191509	135.7743291
31-3	京都市伏見区向島二ノ丸町151番地	向島中央公園(向島ニュータウン5街区1棟南側)	34.9180209	135.774826
31-4	京都市伏見区向島二ノ丸町151番地	向島中央公園(向島運動公園北西側)	34.9175546	135.7745899
31-5	京都市伏見区向島四ツ谷池14番地の19	向島ニュータウン6街区2棟前広場(東側)	34.9191211	135.7773928
31-6	京都市伏見区向島二ノ丸町151番地	元向島二の丸小学校(西側)	34.9157072	135.7738818
31-7	京都市伏見区向島二ノ丸町151番地	向島中央公園(向島ニュータウン1街区6棟北側)	34.9160591	135.7718434
31-8	京都市伏見区向島二ノ丸町	向島本二ノ丸排水機場	34.9144162	135.7711681
32-1	京都市伏見区向島二ノ丸町346番地の38	二の丸公園	34.9192817	135.7715544
32-2	京都市伏見区向島二ノ丸町151番地の30	向島ニュータウンニノ丸北バス停前(南側)	34.9189142	135.7728466
32-3	京都市伏見区向島二ノ丸町151番地の30	向島ニュータウンニノ丸バス停前(北側)	34.9179465	135.7728573
32-4	京都市伏見区向島二ノ丸町151番地の30	向島ニュータウンニノ丸中バス停前(北東側)	34.9171636	135.771602
32-5	京都市伏見区向島二ノ丸町151番地の30	向島ニュータウンニノ丸3街区F棟(西側)	34.9188439	135.7699391
32-6	京都市伏見区向島二ノ丸町151番地の31	関西電力送配電株式会社所有地	34.9161382	135.7696869
32-7	京都市伏見区向島二ノ丸町151番地	近鉄向島駅前自転車置場	34.9154608	135.7697727
33-1	京都市伏見区桃山町立売35番地の2	月本誠一所有地	34.9318147	135.7694601
33-2	京都市伏見区桃山町泰長老176番地の1	タイムズUR観月橋駐車場(西側)	34.9301067	135.7680939
33-3	京都市伏見区桃山町泰長老176番地の1	観月橋団地管理事務所前	34.9301507	135.7700036
33-4	京都市伏見区桃山町泰長老99番地の10	若山俊一方		
34-1	京都市伏見区桃山町鍋島8番地の1	笠置屋桃山駐車場	34.9324851	135.7708534
34-2	京都市伏見区桃山町松平武蔵1番地	JR桃山駅東側	34.9325574	135.772586
34-3	京都市伏見区桃山町筑前台町3番地	笠置屋筑前台駐車場	34.9346221	135.7695152
34-4	京都市伏見区桃山町本多上野107番地	桃山小学校	34.932846	135.775711
34-5	京都市伏見区桃山町伊賀67番地	府営住宅桃山伊賀団地1棟(西側)	34.9300026	135.7767314
34-6	京都市伏見区桃山町本多上野78番地の15	本多上野公園	34.9314945	135.7752472
34-7	京都市伏見区桃山町伊賀60番地の9	安田武司方	34.9308601	135.7792208
35-1	京都市伏見区桃山町丹後2番地の6	京都信用金庫南桃山支店駐車場		
35-2	京都市伏見区桃山町大島38番地の2	桃山南団地17棟前	34.9238359	135.7898424
35-3	京都市伏見区桃山南大島町1番地の4	桃山南団地45棟(北側)	34.9247241	135.7865812
35-4	京都市伏見区桃山町大島38番地の515	京都市上下水道局桃山南ポンプ場		
35-5	京都市伏見区桃山町大島38番地の109	桃山南小学校(東側)	34.9265759	135.7889344
35-6	京都市伏見区桃山町大島38番地の109	桃山南小学校(西側)	34.9262328	135.7877542
35-7	京都市伏見区桃山町大島25番地の135	大島公園(東側)	34.9283254	135.7880119
35-8	京都市伏見区桃山南大島町73番地の13	武田吉正方		
35-9	京都市伏見区桃山町養斉25番地	関西電力送配電株式会社所有地	34.9280755	135.7869215
36-1	京都市伏見区桃山与五郎町1番地の93	米田周史方		
36-2	京都市伏見区桃山与五郎町1番地の4	桃山住宅13棟(南側)	34.9283755	135.7818414
36-3	京都市伏見区桃山与五郎町	桃山団地児童遊園(東側)	34.9291208	135.7820474
36-4	京都市伏見区桃山与五郎町	桃山団地児童遊園(南側)	34.9288437	135.782085
37-1	京都市伏見区桃山町日向21番地の1	府営住宅桃山日向団地3棟前	34.9402279	135.7938892
37-2	京都市伏見区桃山町西尾28番地の2	京都市上下水道局桃山ポンプ場		
37-3	京都市伏見区桃山町遠山81番地の37	北遠山公園	34.9361974	135.7907165
37-4	京都市伏見区桃山町町並58番地の7	町並公園	34.9337616	135.7937668
37-5	京都市伏見区桃山町伊庭12番地	桃山東小学校	34.9352586	135.7862539
